{
  "$schema": "https://json-schema.org/draft/2020-12/schema",
  "$id": "https://contracts.fullchaos.dev/acr/v1/context_fabric_investigation_request.v1.schema.json",
  "title": "ACR Context Fabric Investigation Request v1",
  "type": "object",
  "additionalProperties": false,
  "properties": {
    "schema_version": {
      "const": "context_fabric_investigation_request.v1"
    },
    "request_id": {
      "type": "string",
      "minLength": 8,
      "maxLength": 256
    },
    "question": {
      "type": "string",
      "minLength": 1,
      "maxLength": 8000
    },
    "conversation": {
      "type": "array",
      "items": {
        "$ref": "context_fabric_common.v1.schema.json#/$defs/ConversationTurn"
      },
      "maxItems": 50,
      "uniqueItems": true
    },
    "prior_subject_receipts": {
      "type": "array",
      "items": {
        "$ref": "context_fabric_common.v1.schema.json#/$defs/BoundSubjectReceipt"
      },
      "maxItems": 20,
      "uniqueItems": true
    },
    "prior_window_receipts": {
      "description": "CHAOS-3900 W1: winr_-namespaced receipts naming a prior result's own WindowClarification option. A NEW, parallel field to prior_subject_receipts, not an overload of it -- the match target and effect both differ.",
      "type": "array",
      "items": {
        "$ref": "context_fabric_common.v1.schema.json#/$defs/WindowBoundReceipt"
      },
      "maxItems": 20,
      "uniqueItems": true
    },
    "prior_kind_receipts": {
      "description": "CHAOS-3900 P1: kindr_-namespaced receipts naming a prior result's own StructureNeeds.kind_options entry. A NEW, parallel field, not an overload of prior_subject_receipts or prior_window_receipts -- the match target and effect both differ.",
      "type": "array",
      "items": {
        "$ref": "context_fabric_common.v1.schema.json#/$defs/KindBoundReceipt"
      },
      "maxItems": 20,
      "uniqueItems": true
    },
    "prior_anchor_receipts": {
      "description": "CHAOS-3900 P1: ancr_-namespaced receipts naming a prior result's own StructureNeeds.anchor_options entry.",
      "type": "array",
      "items": {
        "$ref": "context_fabric_common.v1.schema.json#/$defs/AnchorBoundReceipt"
      },
      "maxItems": 20,
      "uniqueItems": true
    },
    "prior_handle_receipts": {
      "description": "CHAOS-3900 P1: handr_-namespaced receipts naming a prior result's own StructureNeeds.handle_options entry.",
      "type": "array",
      "items": {
        "$ref": "context_fabric_common.v1.schema.json#/$defs/HandleBoundReceipt"
      },
      "maxItems": 20,
      "uniqueItems": true
    },
    "prior_candidate_receipts": {
      "description": "CHAOS-4012: candr_-namespaced receipts naming a prior result's own StructureNeeds.candidate_options entry.",
      "type": "array",
      "items": {
        "$ref": "context_fabric_common.v1.schema.json#/$defs/CandidateBoundReceipt"
      },
      "maxItems": 20,
      "uniqueItems": true
    },
    "parent_result_id": {
      "type": "string",
      "minLength": 8,
      "maxLength": 256,
      "description": "Result id of the investigation this turn follows. Optional. Seeds the same-conversation carry walk only; it never binds the named result's subjects into this turn. Bounded identically to prior_*_receipts[].result_id so the two can never disagree about what a well-formed result id is."
    },
    "expected_kinds": {
      "description": "CHAOS-3972 P3, design brief section 2.3/2.0/DP12(b): the caller's own explicit expected_kind guess(es). Per the DP12(b) uniform surface split, this NEVER mints question_stated authority by itself -- on the MCP surface it enters at inferred_default/explicit_unattributed (drives census-narrowing and offer-shaping only); every other surface keeps 3900 v5.2's ordinary question_stated rule.",
      "type": "array",
      "items": {
        "$ref": "context_fabric_common.v1.schema.json#/$defs/SubjectKind"
      },
      "maxItems": 15,
      "uniqueItems": true
    },
    "subject_handles": {
      "description": "CHAOS-3972 P3, design brief section 2.3: grammar-typed handle values the caller already knows. pattern_id must name one of the closed handle-grammar registry entries this deployment discloses via StructureNeeds.accepted_grammars -- never free text or a caller-supplied regex.",
      "type": "array",
      "items": {
        "$ref": "context_fabric_common.v1.schema.json#/$defs/RequestedHandle"
      },
      "maxItems": 20,
      "uniqueItems": true
    },
    "supplied_interpretation": {
      "type": "object",
      "additionalProperties": false,
      "description": "An interpretation the caller ran on its own model. When present the service runs no interpretation call: output is validated exactly as a model output is, and resolution, authorization, retrieval and answer assembly run unchanged. model_output_version, prompt_version and system_sha256 name the contract the caller ran. All three are required: a value that is absent or does not equal the service's own is refused with status 409 and the current values.",
      "properties": {
        "output": {
          "type": "object",
          "description": "The model output object, at most 32768 bytes serialized."
        },
        "model_output_version": {
          "type": "string",
          "minLength": 1,
          "maxLength": 256
        },
        "prompt_version": {
          "type": "string",
          "minLength": 1,
          "maxLength": 256
        },
        "system_sha256": {
          "type": "string",
          "pattern": "^[0-9a-f]{64}$"
        },
        "client_model": {
          "type": "string",
          "pattern": "^[A-Za-z0-9._:/-]{1,128}$"
        }
      },
      "required": [
        "output",
        "model_output_version",
        "prompt_version",
        "system_sha256"
      ]
    },
    "synthesis_mode": {
      "type": "string",
      "enum": [
        "server",
        "client"
      ],
      "description": "Who writes the answer. Absent or server: the service's own model writes it. client: the service runs everything but its synthesis call and returns, beside the stored result, the synthesis input for the caller's model to write the answer from. Nothing the caller writes is sent back or stored."
    },
    "requested_scope": {
      "$ref": "context_fabric_common.v1.schema.json#/$defs/RequestedScope"
    },
    "time_context": {
      "$ref": "context_fabric_common.v1.schema.json#/$defs/TimeContext"
    },
    "options": {
      "$ref": "context_fabric_common.v1.schema.json#/$defs/InvestigationOptions"
    },
    "consumer": {
      "$ref": "context_fabric_common.v1.schema.json#/$defs/ConsumerInfo"
    }
  },
  "required": [
    "schema_version",
    "request_id",
    "question",
    "time_context",
    "options",
    "consumer"
  ]
}
